{
  "$schema": "https://json-schema.org/draft/2020-12/schema",
  "$id": "https://sovereign.local/schemas/sigma/sigma-agent-overlay.schema.json",
  "title": "sigma-agent-overlay",
  "type": "object",
  "additionalProperties": false,
  "required": [
    "schema_version",
    "extends",
    "production_ref",
    "agent",
    "scope",
    "interfaces",
    "delegation",
    "routing",
    "memory",
    "gates",
    "failures",
    "authority_profile",
    "external_contact",
    "protected_channel"
  ],
  "properties": {
    "schema_version": {
      "const": "1.0.0"
    },
    "extends": {
      "const": "_base-policy.json"
    },
    "production_ref": {
      "type": "string"
    },
    "agent": {
      "type": "object"
    },
    "scope": {
      "type": "object"
    },
    "interfaces": {
      "type": "object"
    },
    "delegation": {
      "type": "object"
    },
    "routing": {
      "type": "object"
    },
    "memory": {
      "type": "object"
    },
    "gates": {
      "type": "array"
    },
    "failures": {
      "type": "array"
    },
    "authority_profile": {
      "type": "string"
    },
    "external_contact": {
      "type": "boolean"
    },
    "protected_channel": {
      "type": "boolean"
    }
  }
}
