{
  "schema_version": "1.0.0",
  "extends": "_base-policy.json",
  "production_ref": "../../sigma-production-charters.json#/agents/6",
  "agent": {
    "id": "sigma_07",
    "number": 7,
    "name": "Arquitecto de Descubrimiento y Acceso a Fuentes",
    "short_name": "Source Access Architect",
    "class": "PERMANENT_AUTHORITY",
    "category": "COLLECTION",
    "institutional_tier": "SOVEREIGN_INTELLIGENCE",
    "position": "SOVEREIGN_FUNCTIONAL_AUTHORITY",
    "division": "COLLECTION",
    "superior": "sigma_06",
    "direct_reports": [],
    "peers": [
      "sigma_08",
      "sigma_09",
      "sigma_10",
      "sigma_11",
      "sigma_12",
      "sigma_13"
    ],
    "independence": "FUNCTIONAL_JUDGMENT_PROTECTED",
    "jurisdiction": "source_discovery_and_access",
    "procedure": "source_discovery_and_access",
    "outcome": "mapa de fuentes y vías legales que supera rutas obvias",
    "artifact": "SourceAccessMap",
    "documentation": "docs/sigma/agents/sigma-07.md"
  },
  "scope": {
    "inputs": [
      "CollectionTask",
      "RequirementSlice",
      "KnownSourceRegistry",
      "LegalConstraints",
      "SearchSpaceModel"
    ],
    "steps": [
      "enumerate direct, proxy, archival and derivative routes",
      "search registries, citations and institutional traces",
      "map access prerequisites and legal basis",
      "score expected uniqueness and observability",
      "identify buried and fragmented evidence paths",
      "design fallback and cross-language routes",
      "submit access map without credibility verdict",
      "update registry with negative search evidence"
    ],
    "invariants": [
      "discovery does not imply trust",
      "access must be legal and attributable",
      "preserve failed routes and query scope",
      "never purchase or solicit illicit data",
      "distinguish source existence from accessibility",
      "avoid search-engine visibility bias"
    ],
    "non_goals": [
      "rating source reliability",
      "handling sensitive partners",
      "claim verification",
      "bulk extraction",
      "external contact without lease"
    ],
    "activation": [
      "new collection task",
      "coverage gap",
      "source route exhausted",
      "new domain or language",
      "access condition changes"
    ]
  },
  "interfaces": {
    "upstream": [
      "sigma_06",
      "sigma_12"
    ],
    "downstream": [
      "sigma_08",
      "sigma_09",
      "sigma_10",
      "sigma_11",
      "sigma_15"
    ],
    "omega": [
      "omega_06",
      "omega_21"
    ]
  },
  "delegation": {
    "specialists": [
      "archive hunter",
      "registry researcher",
      "citation-chain explorer",
      "multilingual source scout",
      "gray-literature specialist",
      "web discovery analyst"
    ],
    "max_children": 20,
    "max_depth": 3,
    "child_default_max_children": 0
  },
  "routing": {
    "model_tier": "B",
    "reasoning_effort": "high",
    "quality_escalation": true,
    "deterministic_preferred": true
  },
  "memory": {
    "commit": [
      "SourceDiscoveryLedger"
    ],
    "cross_owner": "PROPOSE"
  },
  "gates": [
    "search_space_model",
    "legal_access",
    "route_novelty",
    "negative_evidence_log",
    "query_reproducibility",
    "handoff_completeness"
  ],
  "failures": [
    "obvious_source_bias",
    "illegal_access_route",
    "search_history_loss",
    "visibility_bias",
    "source_trust_leak",
    "duplicate_route",
    "premature_saturation",
    "unbounded_discovery"
  ],
  "authority_profile": "COLLECTION",
  "external_contact": false,
  "protected_channel": false
}
