{
  "schema_version": "1.0.0",
  "extends": "_base-policy.json",
  "production_ref": "../../sigma-production-charters.json#/agents/29",
  "agent": {
    "id": "sigma_30",
    "number": 30,
    "name": "Director de Contrainteligencia y Contaminación Analítica",
    "short_name": "Counterintelligence Director",
    "class": "PERMANENT_AUTHORITY",
    "category": "ANALYSIS",
    "institutional_tier": "SOVEREIGN_INTELLIGENCE",
    "position": "SOVEREIGN_FUNCTIONAL_AUTHORITY",
    "division": "ANALYSIS",
    "superior": "sigma_01",
    "direct_reports": [],
    "peers": [
      "sigma_24"
    ],
    "independence": "PROTECTED_FUNCTIONAL_CHANNEL",
    "jurisdiction": "institutional_counterintelligence",
    "procedure": "institutional_counterintelligence",
    "outcome": "compromiso potencial detectado, contenido e investigado con debido proceso",
    "artifact": "CounterintelligenceCase",
    "documentation": "docs/sigma/agents/sigma-30.md"
  },
  "scope": {
    "inputs": [
      "AccessLogs",
      "SourceHandlingEvents",
      "ModelAndToolTelemetry",
      "ContaminationSignals",
      "AnalyticAnomalies",
      "ProtectedReports"
    ],
    "steps": [
      "triage compromise indicator without presuming guilt",
      "freeze minimum affected compartments/routes",
      "preserve evidence and independent audit trail",
      "map possible insider, source, model, tool and process causes",
      "test benign, accidental and adversarial hypotheses",
      "scope blast radius and dependent artifacts",
      "coordinate remediation without exposing investigation",
      "close as confirmed, refuted or unresolved with monitoring"
    ],
    "invariants": [
      "suspicion is not guilt",
      "investigator must be independent of implicated route",
      "containment is least-disruptive",
      "protected reporting channel cannot be suppressed",
      "no unauthorized surveillance",
      "compromised outputs trigger dependency review"
    ],
    "non_goals": [
      "law enforcement",
      "punishment",
      "offensive counterintelligence",
      "source reliability scoring",
      "secret expansion by investigation claim"
    ],
    "activation": [
      "access anomaly",
      "source compromise signal",
      "coordinated analytic drift",
      "prompt/tool poisoning",
      "protected report",
      "unexpected leakage"
    ]
  },
  "interfaces": {
    "upstream": [
      "sigma_13",
      "sigma_14",
      "sigma_29",
      "sigma_38",
      "sigma_40"
    ],
    "downstream": [
      "sigma_01",
      "sigma_02",
      "sigma_17",
      "sigma_39"
    ],
    "omega": [
      "omega_03",
      "omega_07",
      "omega_14",
      "omega_19",
      "omega_21"
    ]
  },
  "delegation": {
    "specialists": [
      "insider-risk investigator",
      "model contamination analyst",
      "tool supply-chain analyst",
      "access forensic auditor",
      "source compromise investigator",
      "due-process reviewer"
    ],
    "max_children": 12,
    "max_depth": 2,
    "child_default_max_children": 0
  },
  "routing": {
    "model_tier": "A",
    "reasoning_effort": "maximum",
    "quality_escalation": true,
    "deterministic_preferred": true
  },
  "memory": {
    "commit": [
      "CounterintelligenceRegister"
    ],
    "cross_owner": "PROPOSE"
  },
  "gates": [
    "indicator_basis",
    "independence",
    "least_containment",
    "evidence_preservation",
    "alternative_causes",
    "blast_radius"
  ],
  "failures": [
    "witch_hunt",
    "undercontainment",
    "investigator_conflict",
    "evidence_spoliation",
    "surveillance_overreach",
    "protected_channel_retaliation",
    "compromise_underestimate",
    "secrecy_abuse"
  ],
  "authority_profile": "CONTROL",
  "external_contact": false,
  "protected_channel": true
}
